{"allow_exclusions":false,"artifact_protocol":{"artifact_identity":"complete bytes and normalized relative path; digest is commitment and index only","authoritative_files":["validation.json","resource_validation.json","producer delivery","verifier A report","verifier B report","stage logs","frozen binding records"],"maximum_candidate_count":8,"maximum_published_allocated_bytes":2147483648,"maximum_published_logical_bytes":2147483648,"tree_root_domains":{"evidence":"chemgraph-v0.6/e2-launcher-v0.1/evidence-tree","published":"chemgraph-v0.6/e2-launcher-v0.1/published-tree"}},"authorization_protocol":{"authorization_by_contract_mutation_forbidden":true,"authorization_records_external_to_contract":true,"canonical_record_encoding":"UTF-8 canonical JSON with sorted keys, compact separators, one trailing LF, and duplicate keys rejected","dry_run":{"maximum_authorized_runs":1,"official_publication_forbidden":true,"record_kind":"chemgraph-e2-dry-run-authorization-v0.1","required_bindings":["contract_sha256","contract_schema_sha256","implementation_commit","launcher_source_freeze_sha256","authorization_record_schema_sha256","test_bundle_sha256","external_tool_dependency_closure_sha256","reviewer_1_attestation_sha256","reviewer_2_attestation_sha256","run_nonce"],"required_gate_results":["implementation_commit_frozen","launcher_source_freeze_passed","authorization_record_schema_passed","negative_tests_passed","external_tool_dependency_closure_passed","reviewer_1_independent_passed","reviewer_2_independent_passed"],"reviewer_count":2,"reviewers_must_be_distinct_and_independent_from_implementation_author":true},"execution_authorized_field_semantics":"false means the P0 and launcher contracts alone authorize no execution; authorization can only come from a matching unconsumed external phase record","matching_unconsumed_record_required":true,"official":{"maximum_authorized_runs":1,"record_kind":"chemgraph-e2-official-authorization-v0.1","required_bindings":["contract_sha256","contract_schema_sha256","implementation_commit","launcher_source_freeze_sha256","dry_run_authorization_record_sha256","dry_run_validation_sha256","redteam_validation_sha256","authorization_record_schema_sha256","run_nonce"],"required_gate_results":["dry_run_authorization_consumed_once","dry_run_validation_passed","redteam_validation_passed","official_authorization_record_schema_passed"]},"phase_order":["implementation_freeze","dry_run_authorization","single_dry_run","dry_run_and_redteam_review","official_authorization","single_official_run"],"record_binding_or_consumption_mismatch_is_whole_run_no_go":true},"cgroup_protocol":{"controllers":["cpuset","memory","pids"],"full_pipeline_accounting":"from the pre-exec deadline record through archive, extraction, producer, both verifiers, copying, metadata changes, fsync, atomic rename, parent fsync, and post-publication verification","inner":{"memory_max_bytes":8053063680,"pids_max":256},"memory_peak_formula":"monitor memory.peak plus inner memory.peak; no max-of-groups substitution","monitor":{"memory_max_bytes":536870912,"pids_max":16},"oom_event_keys":["oom","oom_kill","oom_group_kill"],"oom_required_total":0,"placement":"watchdog/monitor and every descendant are in monitor cgroup; inner supervisor and every operational descendant are in inner sibling cgroup before any source or output byte is read","total_memory_max_bytes":8589934592},"cpuset_protocol":{"cpuset_controller_required":true,"effective_set_must_equal_selected":true,"physical_core_selection":"four distinct physical package/core pairs from the launcher's inherited allowed set, lowest CPU per pair, ascending","selected_cpu_count":4,"worker_affinity_changes_forbidden":true,"write_order":["cpuset.mems","cpuset.cpus","verify cpuset.mems.effective","verify cpuset.cpus.effective","move process"]},"execution_authorized":false,"execution_order":["watchdog_records_deadline_before_inner_exec","freeze_all_bindings_and_tool_fds","create_and_verify_cgroup_envelope","inner_creates_private_mount_and_network_namespaces","inner_closes_mount_and_temporary_write_surface","inner_drops_identity_and_capabilities","producer","stage_quiescence_producer","verifier_a","stage_quiescence_verifier_a","verifier_b","stage_quiescence_verifier_b","final_validation_and_resource_gates","metadata_then_fsync","atomic_publication","parent_fsync_and_post_publication_verify"],"external_tools":[{"invoked_path":"/usr/bin/bwrap","kind":"executable","resolved_path":"/usr/bin/bwrap","role":"bubblewrap_namespace_executor","sha256":"d78807229d616606e339c5988392b9e0ab4a6a6998fa51e4590837f426a12fca"},{"invoked_path":"/usr/bin/gcc","kind":"executable","resolved_path":"/usr/bin/x86_64-linux-gnu-gcc-11","role":"gcc","sha256":"821af3c74506283c179ca413bb33e6b528805a4dd8a5c09df125e5ad560a9e89"},{"invoked_path":"/usr/bin/git","kind":"executable","resolved_path":"/usr/bin/git","role":"git","sha256":"587ef21868c948b883993e23209b86a72a6ddc06aab1545c697ffc31075acd4a"},{"invoked_path":"/usr/bin/mount","kind":"executable","resolved_path":"/usr/bin/mount","role":"mount","sha256":"bad230d68e012eb1a2fcaa3b42688d912940f5c61f041ae9451eee7dfb858ff1"},{"invoked_path":"/usr/bin/nsenter","kind":"executable","resolved_path":"/usr/bin/nsenter","role":"nsenter_negative_probe","sha256":"631eb1f92f1d6ff87ddc59f4fe589c06ecd997d51645422f5df5fc6e98630f5a"},{"invoked_path":"/usr/bin/python3.10","kind":"executable","resolved_path":"/usr/bin/python3.10","role":"python_verifier_a","sha256":"7d51cd6b48b521277f5caa4610a82126e315fa2be4df069823a8b1eeb5bd4a86"},{"invoked_path":"/home/zhenghe/miniconda3/bin/python3.13","kind":"executable","resolved_path":"/home/zhenghe/miniconda3/bin/python3.13","role":"python_producer","sha256":"77efe60b46920be1453ff7a4f6693e725a98f81a7e9673806e875a82213baa5d"},{"invoked_path":"/usr/bin/setpriv","kind":"executable","resolved_path":"/usr/bin/setpriv","role":"setpriv","sha256":"960ac94d6b4d095d67d44b00b9b23b3f5e5e609d4539d2223c7c70ed559108ba"},{"invoked_path":"/usr/bin/umount","kind":"executable","resolved_path":"/usr/bin/umount","role":"umount","sha256":"80e84907e5cb4248255c3985e2f7ed55d14fbd45d344a599fdb5cac314b9473c"},{"invoked_path":"/usr/bin/unshare","kind":"executable","resolved_path":"/usr/bin/unshare","role":"unshare","sha256":"72a34e6ba98a59f1da0c7b4d8c9722b746b5ade54e4d7e8de8e519c2993858ad"},{"invoked_path":"/usr/lib/x86_64-linux-gnu/libz.so.1.2.11","kind":"shared_library","resolved_path":"/usr/lib/x86_64-linux-gnu/libz.so.1.2.11","role":"zlib","sha256":"64c206f0146cc58bbddc4f22054436f4ff278f5a554aa3ce6921ddf7e9133370"}],"identity_network_protocol":{"ambient_capabilities":"empty","bounding_capabilities":"empty","effective_capabilities":"empty","gid":61184,"host_network_fd_source":"watchdog opens the host network namespace before unshare and passes a read-only descriptor solely for the negative setns proof","host_setns_negative":{"expected_errno":"EPERM","required":true,"success_is_whole_run_no_go":true},"identity_name":"chemgraph-pilot","inheritable_capabilities":"empty","loopback_required_state":["down","unknown"],"namespace_executor_role":"bubblewrap_namespace_executor","network_namespace_order":["unshare_new_network_namespace_as_root","construct_mount_namespace","setgroups_empty","setgid_61184","setuid_61184","clear_bounding_inheritable_permitted_effective_ambient_capabilities","set_no_new_privs","verify_proc_status_and_negative_setns","exec_stage"],"no_new_privs":1,"permitted_capabilities":"empty","supplementary_groups":"empty","uid":61184},"implementation_status":{"launcher_source_freeze_required":true,"state":"contract_frozen_implementation_absent","whole_run_policy":"NO_GO until an independently audited launcher source freeze binds every launcher, schema, test, executable dependency, and shared-library dependency"},"launcher_boundary":{"inner":"The inner supervisor performs every source/archive/output operation inside the inner cgroup and private namespaces; it cannot publish directly and communicates only framed closed-schema records over a pre-opened SOCK_SEQPACKET channel.","monitor":"The external watchdog records the deadline before inner exec, owns pidfds/cgroupfds/namespace fds, validates every frozen descriptor, services quiescence handshakes, applies hard kill, validates receipts, and performs only the final same-filesystem rename/fsync/post-check while itself remains in the monitor cgroup.","pre_migration_rule":"Before monitor cgroup migration, only fixed CLI parsing and cgroup creation are allowed; VmSize and elapsed time are recorded and conservatively included in resource receipts.","trust_boundary":"Inner reports never satisfy a gate by assertion; the monitor independently reads cgroup, mount, process, file, metadata, and clock state."},"mount_protocol":{"authorized_writable_mounts":[{"maximum_bytes":17179869184,"mountpoint":"/work","purpose":"all source archives, extraction, compiler output, runner output, logs, HOME, TMPDIR, TEMP, and TMP"},{"maximum_bytes":2147483648,"mountpoint":"/publish-stage","purpose":"same-filesystem hidden publication stage only"}],"forbidden_write_probes":["workspace root","source snapshot","/tmp","/var/tmp","/dev/shm","current working directory outside /work","authoritative result root outside /publish-stage"],"mount_namespace_private":true,"mount_setattr_recursive_readonly_required":true,"root_mount_readonly":true,"source_snapshot_readonly_after_extraction":true,"temporary_environment":{"HOME":"/work/home","TEMP":"/work/tmp","TMP":"/work/tmp","TMPDIR":"/work/tmp"},"unexpected_writable_mount_is_whole_run_no_go":true,"write_probe_errno":["EROFS","EACCES"]},"publication_protocol":{"atomicity":"hidden stage and final output are direct children of /opt/chemgraph/results on the same filesystem; renameat2 without replacement then fsync parent","failure_policy":"Any false or missing gate forbids authoritative rename; dry-run NO_GO output is stored only outside /opt/chemgraph/results.","metadata":{"directories_mode":"0555","files_mode":"0444","gid":0,"